{
  "artifactKind": "surface_contract_manifest",
  "interfaceContract": {
    "digest": "sha256:8fb13498ca7c925a369f03fb103e6728e2f3b07b6039e2c9e5604f1d7bcefbcb",
    "key": "nurture.surface-contract",
    "version": "1.1.0"
  },
  "manifestDigest": "sha256:af241d8d5524a6d57a216a3a7ae4aaf48cbadb25d32de780acf35a3d6b1057f6",
  "schemaVersion": 1
}
